{
  "$schema": "https://json-schema.org/draft/2020-12/schema",
  "$id": "harness-guard:rule:1.1",
  "title": "Harness Guard rule",
  "type": "object",
  "required": ["schema_version", "id", "tool", "category", "title", "why_it_matters", "unknown_subject", "os", "scopes", "auth_prerequisites", "observation", "outcomes", "tested_versions", "sources", "limitations", "unknown_conditions"],
  "additionalProperties": false,
  "properties": {
    "schema_version": { "const": "1.1" },
    "id": { "type": "string", "pattern": "^[a-z0-9]+(-[a-z0-9]+)*$" },
    "tool": { "enum": ["codex", "claude-code", "grok-build"] },
    "category": { "enum": ["retention", "telemetry", "training", "transfer", "sync", "permissions", "sandbox", "network"] },
    "title": { "type": "string", "minLength": 1 },
    "why_it_matters": { "type": "string", "minLength": 1 },
    "unknown_subject": { "type": "string", "minLength": 1 },
    "os": { "type": "array", "minItems": 1, "items": { "enum": ["macos", "linux", "windows"] } },
    "scopes": { "type": "array", "minItems": 1, "items": { "enum": ["user", "project", "local", "managed"] } },
    "auth_prerequisites": { "type": ["string", "null"] },
    "observation": {
      "type": "object",
      "required": ["file", "key", "type", "allowed_render"],
      "additionalProperties": false,
      "properties": {
        "file": { "type": "string", "minLength": 1 },
        "key": { "type": "string", "minLength": 1 },
        "type": { "enum": ["enum", "bool", "integer"] },
        "allowed_render": { "type": "array", "minItems": 1, "items": { "type": "string", "minLength": 1 } },
        "integer_bounds": { "type": ["object", "null"], "required": ["min", "max"], "additionalProperties": false, "properties": { "min": { "type": "integer" }, "max": { "type": "integer" } } }
      },
      "allOf": [
        { "if": { "properties": { "type": { "const": "integer" } } },
          "then": { "required": ["integer_bounds"], "properties": { "integer_bounds": { "type": "object" } } } },
        { "if": { "properties": { "type": { "enum": ["enum", "bool"] } } },
          "then": { "properties": { "integer_bounds": { "const": null } } } }
      ]
    },
    "outcomes": {
      "type": "array",
      "minItems": 1,
      "items": {
        "type": "object",
        "required": ["when", "status", "match", "message"],
        "additionalProperties": false,
        "properties": {
          "when": { "type": "string", "minLength": 1 },
          "status": { "enum": ["pass", "finding", "unknown"] },
          "match": {
            "oneOf": [
              { "type": "object", "required": ["equals"], "additionalProperties": false,
                "properties": { "equals": { "type": "object", "required": ["value"], "additionalProperties": false,
                  "properties": { "value": { "type": ["string", "boolean", "integer"] } } } } },
              { "type": "object", "required": ["any_of"], "additionalProperties": false,
                "properties": { "any_of": { "type": "object", "required": ["values"], "additionalProperties": false,
                  "properties": { "values": { "type": "array", "minItems": 1,
                    "items": { "type": ["string", "boolean", "integer"] } } } } } },
              { "type": "object", "required": ["int_range"], "additionalProperties": false,
                "properties": { "int_range": { "type": "object", "required": ["min", "max"], "additionalProperties": false,
                  "properties": { "min": { "type": ["integer", "null"] }, "max": { "type": ["integer", "null"] } } } } },
              { "type": "object", "required": ["unset"], "additionalProperties": false,
                "properties": { "unset": { "const": true } } },
              { "type": "object", "required": ["unrecognized"], "additionalProperties": false,
                "properties": { "unrecognized": { "const": true } } }
            ]
          },
          "severity": { "enum": ["info", "warning", null] },
          "confidence": { "enum": ["low", "medium", "high", null] },
          "message": { "type": "string", "minLength": 1 },
          "remediation": {
            "type": ["object", "null"],
            "required": ["summary", "command"],
            "additionalProperties": false,
            "properties": {
              "summary": { "type": "string", "minLength": 1 },
              "command": { "type": "string", "minLength": 1 }
            }
          },
          "unknown_reason": { "type": ["string", "null"], "minLength": 1 },
          "verify_url": { "type": ["string", "null"], "pattern": "^https://[^\\s/?#]+" }
        },
        "allOf": [
          { "if": { "properties": { "status": { "const": "finding" } } },
            "then": { "required": ["severity", "confidence"], "properties": { "severity": { "enum": ["info", "warning"] }, "confidence": { "enum": ["low", "medium", "high"] }, "unknown_reason": { "const": null }, "verify_url": { "const": null } } } },
          { "if": { "properties": { "status": { "const": "pass" } } },
            "then": { "required": ["confidence"], "properties": { "severity": { "const": null }, "confidence": { "enum": ["low", "medium", "high"] }, "remediation": { "const": null }, "unknown_reason": { "const": null }, "verify_url": { "const": null } } } },
          { "if": { "properties": { "status": { "const": "unknown" } } },
            "then": { "required": ["unknown_reason"], "properties": { "severity": { "const": null }, "confidence": { "const": null }, "remediation": { "const": null }, "unknown_reason": { "type": "string", "minLength": 1 } } } },
          { "if": { "properties": { "match": { "type": "object", "anyOf": [ { "required": ["unset"] }, { "required": ["unrecognized"] } ] } } },
            "then": { "properties": { "status": { "const": "unknown" } } } },
          { "if": { "properties": { "match": { "type": "object", "anyOf": [ { "required": ["equals"] }, { "required": ["any_of"] }, { "required": ["int_range"] } ] } } },
            "then": { "properties": { "status": { "enum": ["pass", "finding"] } } } }
        ]
      }
    },
    "tested_versions": {
      "type": "array",
      "minItems": 1,
      "items": {
        "type": "object",
        "required": ["min", "max", "verified_on"],
        "additionalProperties": false,
        "properties": {
          "min": { "type": "string", "pattern": "^(<=)?\\d+\\.\\d+\\.\\d+$" },
          "max": { "type": "string", "pattern": "^\\d+\\.\\d+\\.\\d+$" },
          "verified_on": { "type": "string", "pattern": "^\\d{4}-\\d{2}-\\d{2}$" }
        }
      }
    },
    "sources": { "type": "array", "items": { "$ref": "#/$defs/source" } },
    "limitations": { "type": "array", "minItems": 1, "items": { "type": "string", "minLength": 1 } },
    "unknown_conditions": { "type": "array", "minItems": 1, "items": { "type": "string", "minLength": 1 } }
  },
  "if": {
    "properties": {
      "outcomes": {
        "contains": { "properties": { "status": { "enum": ["pass", "finding"] } } }
      }
    }
  },
  "then": {
    "properties": { "sources": { "minItems": 1 } }
  },
  "$defs": {
    "source": {
      "type": "object",
      "required": ["schema_version", "url", "publisher", "title", "evidence_class", "retrieved", "content_hash"],
      "additionalProperties": false,
      "properties": {
        "schema_version": { "const": "1.0" },
        "url": { "type": "string", "minLength": 1, "pattern": "^https://[^\\s/?#]+" },
        "publisher": { "type": "string", "minLength": 1 },
        "title": { "type": "string", "minLength": 1 },
        "evidence_class": { "enum": ["local-observation", "official-documentation", "official-policy", "independent-reproduction", "inference"] },
        "retrieved": { "type": "string", "pattern": "^\\d{4}-\\d{2}-\\d{2}$" },
        "content_hash": { "type": "string", "pattern": "^sha256:[0-9a-f]{64}$" },
        "archived_url": { "type": ["string", "null"], "pattern": "^https://[^\\s/?#]+" },
        "notes": { "type": ["string", "null"] }
      }
    }
  }
}
