{
  "schema_version": "1.1",
  "id": "grok-build-otel-prompt-log-01",
  "tool": "grok-build",
  "category": "telemetry",
  "title": "Raw user prompt export via external OpenTelemetry",
  "why_it_matters": "Grok Build's user guide documents an external OpenTelemetry stream under the [telemetry] table that is independent of the product telemetry master switch and ships to the operator's own OTLP collector. Within that table, otel_log_user_prompts is the content gate for raw user prompts; the documented example sets otel_log_user_prompts = false. This rule observes only that boolean at user scope: it does not inspect otel_enabled, exporters, or endpoints, so an enabled flag has no effect while external OTEL remains off, and other configuration layers are not inspected.",
  "unknown_subject": "external OpenTelemetry raw prompt export posture",
  "os": [
    "macos",
    "linux"
  ],
  "scopes": [
    "user"
  ],
  "auth_prerequisites": null,
  "observation": {
    "file": "config.toml",
    "key": "telemetry.otel_log_user_prompts",
    "type": "bool",
    "allowed_render": [
      "true",
      "false",
      "unset"
    ]
  },
  "outcomes": [
    {
      "when": "telemetry.otel_log_user_prompts is explicitly false",
      "status": "pass",
      "match": {
        "equals": {
          "value": false
        }
      },
      "severity": null,
      "confidence": "high",
      "message": "The inspected user-level config keeps raw user prompts redacted from external OpenTelemetry logs (telemetry.otel_log_user_prompts = false).",
      "remediation": null
    },
    {
      "when": "telemetry.otel_log_user_prompts is explicitly true in the user-level config",
      "status": "finding",
      "match": {
        "equals": {
          "value": true
        }
      },
      "severity": "warning",
      "confidence": "high",
      "message": "The inspected user-level config explicitly opts in to exporting raw user prompts with external OpenTelemetry logs (telemetry.otel_log_user_prompts = true).",
      "remediation": {
        "summary": "Stop exporting raw user prompts via external OpenTelemetry.",
        "command": "Add to GROK_HOME/config.toml (normally ~/.grok/config.toml):\n[telemetry]\notel_log_user_prompts = false"
      }
    },
    {
      "when": "telemetry.otel_log_user_prompts is unset in the user-level config or the user-level config is absent",
      "status": "unknown",
      "match": {
        "unset": true
      },
      "severity": null,
      "confidence": null,
      "message": "Effective external OpenTelemetry raw prompt export posture cannot be determined from an unset user-level value because uninspected configuration layers may supply or override it.",
      "unknown_reason": "telemetry.otel_log_user_prompts is unset in the user-level config; the user guide example redacts raw prompts (false) and OSS types default the Option to None (off unless enabled), but uninspected CLI flags, environment variables, managed/requirements config, or other layers may determine the effective value.",
      "verify_url": "https://github.com/xai-org/grok-build/blob/main/crates/codegen/xai-grok-pager/docs/user-guide/05-configuration.md"
    },
    {
      "when": "telemetry.otel_log_user_prompts is set to a value outside boolean true/false",
      "status": "unknown",
      "match": {
        "unrecognized": true
      },
      "severity": null,
      "confidence": null,
      "message": "telemetry.otel_log_user_prompts is set to an unrecognized value \u2014 raw values are never displayed.",
      "unknown_reason": "telemetry.otel_log_user_prompts is set to an unrecognized value \u2014 raw values are never displayed",
      "verify_url": "https://github.com/xai-org/grok-build/blob/main/crates/codegen/xai-grok-pager/docs/user-guide/05-configuration.md"
    }
  ],
  "tested_versions": [
    {
      "min": "<=1.0.3",
      "max": "1.0.3",
      "verified_on": "2026-08-13"
    }
  ],
  "sources": [
    {
      "schema_version": "1.0",
      "url": "https://github.com/xai-org/grok-build/blob/main/crates/codegen/xai-grok-pager/docs/user-guide/05-configuration.md",
      "publisher": "xAI",
      "title": "Grok Build user guide \u2014 Configuration",
      "evidence_class": "official-documentation",
      "retrieved": "2026-08-13",
      "content_hash": "sha256:cd16d3a9758ce038de942f83b86e4c3ac271fbd31b01afe7b83c32ddae4ec2b9",
      "archived_url": "https://web.archive.org/web/20260813152448/https://github.com/xai-org/grok-build/blob/main/crates/codegen/xai-grok-pager/docs/user-guide/05-configuration.md",
      "notes": "In-tree user guide at OSS SOURCE_REV ba69d70c2f7d70a130a323b2becdf137af784c7f (retrieved 2026-07-17). Documents external OTEL under [telemetry] with otel_log_user_prompts = false as the content gate. External OTEL is independent of the product telemetry toggle. Local posture only. Re-verified 2026-08-13 against channel/npm 1.0.3 and monorepo SOURCE_REV ea094a8c369475f97c85540d01730baec0dce5d6 (main tip e5fd4816d43260c15ba785f103990c1ed6cea230); observation keys and documented defaults unchanged through 1.0.3."
    },
    {
      "schema_version": "1.0",
      "url": "https://github.com/xai-org/grok-build/blob/main/crates/codegen/xai-grok-telemetry/src/config.rs",
      "publisher": "xAI",
      "title": "Grok Build telemetry configuration types",
      "evidence_class": "official-documentation",
      "retrieved": "2026-08-13",
      "content_hash": "sha256:4939cadc8d141187503eaad1a793a723b2d987333f6fb648a717c1f1f7da132f",
      "archived_url": "https://web.archive.org/web/20260813152506/https://github.com/xai-org/grok-build/blob/main/crates/codegen/xai-grok-telemetry/src/config.rs",
      "notes": "OSS SOURCE_REV ba69d70c2f7d70a130a323b2becdf137af784c7f. TelemetryConfig.otel_log_user_prompts: Option<bool> external OTEL content gate; default None in Default impl. Re-verified 2026-08-13 against channel/npm 1.0.3 and monorepo SOURCE_REV ea094a8c369475f97c85540d01730baec0dce5d6 (main tip e5fd4816d43260c15ba785f103990c1ed6cea230); observation keys and documented defaults unchanged through 1.0.3."
    }
  ],
  "limitations": [
    "Only the user-level GROK_HOME/config.toml is inspected; CLI flags, environment variables, managed/requirements config, and project-scoped config are not inspected.",
    "An explicit user-level value describes that layer only and does not prove the effective value for every invocation.",
    "This rule does not inspect otel_enabled, otel_logs_exporter, otel_endpoint, or related exporter keys; the user guide describes external OTEL as an independent opt-in.",
    "This rule cannot confirm any server-side or remote retention of exported OTEL data \u2014 no local file can.",
    "Auth/account state is user-confirmed-or-unknown; this rule never infers it."
  ],
  "unknown_conditions": [
    "Config file unreadable (permissions).",
    "Config file is a symlink or non-regular file (not followed).",
    "telemetry.otel_log_user_prompts is unset in the user-level config or the user-level config is absent; other configuration layers are not inspected.",
    "telemetry.otel_log_user_prompts set to a value outside boolean true/false (raw values are never displayed).",
    "Config file exceeds parse bounds (size > 1 MiB or nesting depth > 32)."
  ]
}
